{
  "id": "L1-global",
  "type": "global",
  "name": "talabat",
  "content": {
    "mission": "Deliver an amazing experience — fast, easy, and to your door.",
    "strategy": "Multi-vertical everyday app for MENA.",
    "operating_principles": ["Customer obsession with unit economics discipline"]
  },
  "sufficiency": {
    "status": "gaps_identified",
    "gaps": [
      {
        "field": "stakeholders",
        "severity": "important",
        "description": "No named individuals — only tribal structure listed."
      }
    ]
  },
  "sources": [
    {
      "type": "document",
      "name": "talabat Strategy Deck Q1 2026",
      "description": "Company mission, strategy pillars, and operating principles",
      "date": "2026-01-15",
      "fields_informed": ["mission", "strategy", "operating_principles"]
    }
  ],
  "created_at": "2026-04-04T22:00:00Z",
  "updated_at": "2026-04-04T22:00:00Z"
}
